,imp_code_str3,imp_name,HS2,Description,USD,tonne
0,100,Bulgaria,27,"Mineral fuels, mineral oils and products of their distillation; bituminous substances; mineral waxes",1349787241.454,3179938.1388689997
1,100,Bulgaria,87,"Vehicles; other than railway or tramway rolling stock, and parts and accessories thereof",1084913736.1690001,149538.017345
2,100,Bulgaria,84,"Machinery and mechanical appliances, boilers, nuclear reactors; parts thereof",963235388.293,121283.03644699999
3,100,Bulgaria,85,"Electrical machinery and equipment and parts thereof; sound recorders and reproducers; television image and sound recorders and reproducers, parts and accessories of such articles",723266844.015,91281.059441
4,100,Bulgaria,39,Plastics and articles thereof,646864191.567,364131.912864
5,100,Bulgaria,72,Iron and steel,589035221.839,908491.541144
6,100,Bulgaria,48,"Paper and paperboard; articles of paper pulp, of paper or paperboard",228725313.789,219970.69443
7,100,Bulgaria,73,Iron or steel articles,225965058.49,122599.317014
8,100,Bulgaria,38,Chemical products n.e.c.,196098616.848,143328.629766
9,100,Bulgaria,74,Copper and articles thereof,171036068.259,31495.675957
10,100,Bulgaria,76,Aluminium and articles thereof,166348320.234,56653.23487100001
11,100,Bulgaria,40,Rubber and articles thereof,159943055.787,42084.006898
12,100,Bulgaria,94,"Furniture; bedding, mattresses, mattress supports, cushions and similar stuffed furnishings; lamps and lighting fittings, n.e.c.; illuminated signs, illuminated name-plates and the like; prefabricated buildings",142728853.984,47226.957024
13,100,Bulgaria,95,"Toys, games and sports requisites; parts and accessories thereof",101726169.815,19793.428717
14,100,Bulgaria,32,"Tanning or dyeing extracts; tannins and their derivatives; dyes, pigments and other colouring matter; paints, varnishes; putty, other mastics; inks",96110950.907,78076.21173699999
15,100,Bulgaria,26,"Ores, slag and ash",94373462.98,89445.33020299999
16,100,Bulgaria,02,Meat and edible meat offal,92694361.606,65665.529991
17,100,Bulgaria,24,"Tobacco and manufactured tobacco substitutes; products, whether or not containing nicotine, intended for inhalation without combustion; other nicotine containing products intended for the intake of nicotine into the human body",79292793.01200001,12185.637848
18,100,Bulgaria,08,"Fruit and nuts, edible; peel of citrus fruit or melons",74016629.631,238548.060513
19,100,Bulgaria,29,Organic chemicals,73633922.707,45723.938927
20,100,Bulgaria,90,"Optical, photographic, cinematographic, measuring, checking, medical or surgical instruments and apparatus; parts and accessories",72617150.199,2975.0687040000003
21,100,Bulgaria,44,Wood and articles of wood; wood charcoal,69250648.139,107242.55768900001
22,100,Bulgaria,04,"Dairy produce; birds' eggs; natural honey; edible products of animal origin, not elsewhere specified or included",68590171.905,43803.692064999996
23,100,Bulgaria,34,"Soap, organic surface-active agents; washing, lubricating, polishing or scouring preparations; artificial or prepared waxes, candles and similar articles, modelling pastes, dental waxes and dental preparations with a basis of plaster",65993661.484,42791.995702
24,100,Bulgaria,22,"Beverages, spirits and vinegar",64696415.203,100684.662368
25,100,Bulgaria,07,Vegetables and certain roots and tubers; edible,63922372.629999995,126195.50314700001
26,100,Bulgaria,15,"Animal, vegetable or microbial fats and oils and their cleavage products; prepared edible fats; animal or vegetable waxes",62390566.931,70430.45734000001
27,100,Bulgaria,83,Metal; miscellaneous products of base metal,59013725.314,11149.449413
28,100,Bulgaria,28,"Inorganic chemicals; organic and inorganic compounds of precious metals; of rare earth metals, of radio-active elements and of isotopes",58663406.864,194568.24668
29,100,Bulgaria,20,"Preparations of vegetables, fruit, nuts or other parts of plants",58486101.293,42339.026242
30,100,Bulgaria,17,Sugars and sugar confectionery,57041451.189,102147.691828
31,100,Bulgaria,60,Fabrics; knitted or crocheted,54227062.971,8113.562189
32,100,Bulgaria,30,Pharmaceutical products,53915952.126,2003.104093
33,100,Bulgaria,61,Apparel and clothing accessories; knitted or crocheted,50656865.177,5602.54387
34,100,Bulgaria,21,Miscellaneous edible preparations,50566445.353,17378.300094
35,100,Bulgaria,70,Glass and glassware,47517469.207,107003.463113
36,100,Bulgaria,33,"Essential oils and resinoids; perfumery, cosmetic or toilet preparations",46862368.326,5340.673982
37,100,Bulgaria,96,Miscellaneous manufactured articles,43671704.516,9060.997047
38,100,Bulgaria,68,"Stone, plaster, cement, asbestos, mica or similar materials; articles thereof",43652649.141,96498.322858
39,100,Bulgaria,86,"Railway, tramway locomotives, rolling-stock and parts thereof; railway or tramway track fixtures and fittings and parts thereof; mechanical (including electro-mechanical) traffic signalling equipment of all kinds",43631868.037999995,9262.330802999999
40,100,Bulgaria,23,"Food industries, residues and wastes thereof; prepared animal fodder",41788559.599,58362.015182
41,100,Bulgaria,31,Fertilizers,39921284.913,149830.375385
42,100,Bulgaria,03,"Fish and crustaceans, molluscs and other aquatic invertebrates",37839006.27,14741.922382
43,100,Bulgaria,56,"Wadding, felt and nonwovens, special yarns; twine, cordage, ropes and cables and articles thereof",37129637.572000004,9609.954910999999
44,100,Bulgaria,12,"Oil seeds and oleaginous fruits; miscellaneous grains, seeds and fruit, industrial or medicinal plants; straw and fodder",34735294.284,25530.945040000002
45,100,Bulgaria,19,"Preparations of cereals, flour, starch or milk; pastrycooks' products",33864738.396,15775.388867999998
46,100,Bulgaria,09,"Coffee, tea, mate and spices",31050319.731,12523.964453
47,100,Bulgaria,62,Apparel and clothing accessories; not knitted or crocheted,27612176.447,1898.841668
48,100,Bulgaria,82,"Tools, implements, cutlery, spoons and forks, of base metal; parts thereof, of base metal",25993877.387000002,2669.2983489999997
49,100,Bulgaria,55,Man-made staple fibres,24396305.14,8182.673105000001
50,100,Bulgaria,59,"Textile fabrics; impregnated, coated, covered or laminated; textile articles of a kind suitable for industrial use",23960493.338,4613.061818
51,100,Bulgaria,54,Man-made filaments; strip and the like of man-made textile materials,22674854.672,7682.795083
52,100,Bulgaria,11,"Products of the milling industry; malt, starches, inulin, wheat gluten",21058545.639,32386.812768
53,100,Bulgaria,69,Ceramic products,20388267.512000002,190265.496361
54,100,Bulgaria,78,Lead and articles thereof,19450477.375,9969.723445999998
55,100,Bulgaria,64,Footwear; gaiters and the like; parts of such articles,17537775.188,1479.789256
56,100,Bulgaria,35,Albuminoidal substances; modified starches; glues; enzymes,16985596.952,5751.269003
57,100,Bulgaria,63,"Textiles, made up articles; sets; worn clothing and worn textile articles; rags",15984036.996,10562.858181
58,100,Bulgaria,42,"Articles of leather; saddlery and harness; travel goods, handbags and similar containers; articles of animal gut (other than silk-worm gut)",15880016.345,1702.421839
59,100,Bulgaria,18,Cocoa and cocoa preparations,15792094.211000001,4496.459202
60,100,Bulgaria,16,"Meat, fish, crustaceans, molluscs or other aquatic invertebrates, or insects; preparations thereof",15620004.424999999,6325.4267899999995
61,100,Bulgaria,25,"Salt; sulphur; earths, stone; plastering materials, lime and cement",14680309.87,178281.467292
62,100,Bulgaria,52,Cotton,13783653.572,4276.033923
63,100,Bulgaria,51,"Wool, fine or coarse animal hair; horsehair yarn and woven fabric",13110066.636,1870.361013
64,100,Bulgaria,10,Cereals,8573628.477,14671.029604000001
65,100,Bulgaria,91,Clocks and watches and parts thereof,7855801.944,55.353487
66,100,Bulgaria,06,"Trees and other plants, live; bulbs, roots and the like; cut flowers and ornamental foliage",6473316.856000001,2043.213825
67,100,Bulgaria,58,"Fabrics; special woven fabrics, tufted textile fabrics, lace, tapestries, trimmings, embroidery",5969385.528,432.846049
68,100,Bulgaria,05,Animal originated products; not elsewhere specified or included,5839655.359999999,3025.425541
69,100,Bulgaria,41,Raw hides and skins (other than furskins) and leather,5721319.297,392.616669
70,100,Bulgaria,47,Pulp of wood or other fibrous cellulosic material; recovered (waste and scrap) paper or paperboard,5639894.453,9745.264267
71,100,Bulgaria,88,"Aircraft, spacecraft, and parts thereof",4974190.845000001,35.663948
72,100,Bulgaria,57,Carpets and other textile floor coverings,3981954.913,2457.280065
73,100,Bulgaria,49,"Printed books, newspapers, pictures and other products of the printing industry; manuscripts, typescripts and plans",3916024.1130000004,753.377568
74,100,Bulgaria,37,Photographic or cinematographic goods,3723954.366,558.276704
75,100,Bulgaria,89,"Ships, boats and floating structures",3362064.607,196.630867
76,100,Bulgaria,43,Furskins and artificial fur; manufactures thereof,3208925.422,64.671355
77,100,Bulgaria,13,"Lac; gums, resins and other vegetable saps and extracts",2878165.26,370.569433
78,100,Bulgaria,71,"Natural, cultured pearls; precious, semi-precious stones; precious metals, metals clad with precious metal, and articles thereof; imitation jewellery; coin",2760267.562,172.802506
79,100,Bulgaria,53,Vegetable textile fibres; paper yarn and woven fabrics of paper yarn,2240187.234,508.422979
80,100,Bulgaria,80,Tin; articles thereof,1925617.5999999999,110.942103
81,100,Bulgaria,65,Headgear and parts thereof,1523830.1400000001,261.900466
82,100,Bulgaria,79,Zinc and articles thereof,1491146.015,317.30751599999996
83,100,Bulgaria,45,Cork and articles of cork,1426579.536,232.486453
84,100,Bulgaria,81,"Metals; n.e.c., cermets and articles thereof",600700.0719999999,75.767789
85,100,Bulgaria,66,"Umbrellas, sun umbrellas, walking-sticks, seat sticks, whips, riding crops; and parts thereof",500063.331,346.169668
86,100,Bulgaria,75,Nickel and articles thereof,474242.83300000004,122.935063
87,100,Bulgaria,36,Explosives; pyrotechnic products; matches; pyrophoric alloys; certain combustible preparations,399053.041,630.068601
88,100,Bulgaria,46,"Manufactures of straw, esparto or other plaiting materials; basketware and wickerwork",336213.916,134.219718
89,100,Bulgaria,92,Musical instruments; parts and accessories of such articles,317074.673,23.819043
90,100,Bulgaria,67,"Feathers and down, prepared; and articles made of feather or of down; artificial flowers; articles of human hair",239711.207,45.902432
91,100,Bulgaria,50,Silk,38121.543000000005,0.456029
92,100,Bulgaria,97,Works of art; collectors' pieces and antiques,10227.217,3.5290479999999995
93,100,Bulgaria,14,Vegetable plaiting materials; vegetable products not elsewhere specified or included,1938.1380000000001,1.2876210000000001
94,100,Bulgaria,01,Animals; live,0.33699999999999997,3.400426
