,exp_code_str3,exp_name,HS2,Description,USD,tonne
0,694,Sierra Leone,26,"Ores, slag and ash",81973064.61400001,1830619.417758
1,694,Sierra Leone,44,Wood and articles of wood; wood charcoal,30664250.601999998,55283.975770000005
2,694,Sierra Leone,03,"Fish and crustaceans, molluscs and other aquatic invertebrates",20093969.066999998,23641.488827
3,694,Sierra Leone,72,Iron and steel,5209166.697,16437.776973
4,694,Sierra Leone,27,"Mineral fuels, mineral oils and products of their distillation; bituminous substances; mineral waxes",8672724.995000001,14131.944811000001
5,694,Sierra Leone,15,"Animal, vegetable or microbial fats and oils and their cleavage products; prepared edible fats; animal or vegetable waxes",6633792.924000001,9982.766013
6,694,Sierra Leone,11,"Products of the milling industry; malt, starches, inulin, wheat gluten",582340.417,1959.9920690000001
7,694,Sierra Leone,84,"Machinery and mechanical appliances, boilers, nuclear reactors; parts thereof",18535761.373,1843.252846
8,694,Sierra Leone,18,Cocoa and cocoa preparations,3225130.896,1824.0195110000002
9,694,Sierra Leone,12,"Oil seeds and oleaginous fruits; miscellaneous grains, seeds and fruit, industrial or medicinal plants; straw and fodder",457763.83599999995,1564.470345
10,694,Sierra Leone,89,"Ships, boats and floating structures",694313.666,1097.144081
11,694,Sierra Leone,87,"Vehicles; other than railway or tramway rolling stock, and parts and accessories thereof",5038446.244,1050.551074
12,694,Sierra Leone,40,Rubber and articles thereof,1648930.063,715.9699350000001
13,694,Sierra Leone,85,"Electrical machinery and equipment and parts thereof; sound recorders and reproducers; television image and sound recorders and reproducers, parts and accessories of such articles",1986033.5559999999,520.015971
14,694,Sierra Leone,48,"Paper and paperboard; articles of paper pulp, of paper or paperboard",375699.87600000005,353.32689799999997
15,694,Sierra Leone,94,"Furniture; bedding, mattresses, mattress supports, cushions and similar stuffed furnishings; lamps and lighting fittings, n.e.c.; illuminated signs, illuminated name-plates and the like; prefabricated buildings",965910.363,314.781424
16,694,Sierra Leone,09,"Coffee, tea, mate and spices",927965.318,294.86998
17,694,Sierra Leone,08,"Fruit and nuts, edible; peel of citrus fruit or melons",160257.712,291.286823
18,694,Sierra Leone,70,Glass and glassware,161323.086,267.89765800000004
19,694,Sierra Leone,28,"Inorganic chemicals; organic and inorganic compounds of precious metals; of rare earth metals, of radio-active elements and of isotopes",199911.421,246.15725
20,694,Sierra Leone,39,Plastics and articles thereof,696258.777,223.941213
21,694,Sierra Leone,04,"Dairy produce; birds' eggs; natural honey; edible products of animal origin, not elsewhere specified or included",489903.873,223.897208
22,694,Sierra Leone,73,Iron or steel articles,400435.176,189.231474
23,694,Sierra Leone,22,"Beverages, spirits and vinegar",65687.523,151.709438
24,694,Sierra Leone,20,"Preparations of vegetables, fruit, nuts or other parts of plants",124022.866,148.363471
25,694,Sierra Leone,74,Copper and articles thereof,579269.162,121.266548
26,694,Sierra Leone,76,Aluminium and articles thereof,165195.896,88.18073700000001
27,694,Sierra Leone,32,"Tanning or dyeing extracts; tannins and their derivatives; dyes, pigments and other colouring matter; paints, varnishes; putty, other mastics; inks",236253.05299999999,83.98840299999999
28,694,Sierra Leone,38,Chemical products n.e.c.,200586.66999999998,75.506411
29,694,Sierra Leone,71,"Natural, cultured pearls; precious, semi-precious stones; precious metals, metals clad with precious metal, and articles thereof; imitation jewellery; coin",2337232.593,63.285386
30,694,Sierra Leone,53,Vegetable textile fibres; paper yarn and woven fabrics of paper yarn,26800.802,63.228899
31,694,Sierra Leone,86,"Railway, tramway locomotives, rolling-stock and parts thereof; railway or tramway track fixtures and fittings and parts thereof; mechanical (including electro-mechanical) traffic signalling equipment of all kinds",103661.368,59.53402899999999
32,694,Sierra Leone,68,"Stone, plaster, cement, asbestos, mica or similar materials; articles thereof",135793.61,45.373940000000005
33,694,Sierra Leone,29,Organic chemicals,37832.891,32.134472
34,694,Sierra Leone,16,"Meat, fish, crustaceans, molluscs or other aquatic invertebrates, or insects; preparations thereof",131251.368,31.808334
35,694,Sierra Leone,07,Vegetables and certain roots and tubers; edible,37822.692,24.010984
36,694,Sierra Leone,25,"Salt; sulphur; earths, stone; plastering materials, lime and cement",5642.173,23.954289999999997
37,694,Sierra Leone,17,Sugars and sugar confectionery,11157.569,19.45777
38,694,Sierra Leone,14,Vegetable plaiting materials; vegetable products not elsewhere specified or included,10758.662,19.377225
39,694,Sierra Leone,33,"Essential oils and resinoids; perfumery, cosmetic or toilet preparations",119079.69,16.055163
40,694,Sierra Leone,56,"Wadding, felt and nonwovens, special yarns; twine, cordage, ropes and cables and articles thereof",86725.881,15.927807000000001
41,694,Sierra Leone,83,Metal; miscellaneous products of base metal,80274.978,15.888568999999999
42,694,Sierra Leone,19,"Preparations of cereals, flour, starch or milk; pastrycooks' products",31137.142999999996,13.825942000000001
43,694,Sierra Leone,34,"Soap, organic surface-active agents; washing, lubricating, polishing or scouring preparations; artificial or prepared waxes, candles and similar articles, modelling pastes, dental waxes and dental preparations with a basis of plaster",26888.176,12.338495
44,694,Sierra Leone,90,"Optical, photographic, cinematographic, measuring, checking, medical or surgical instruments and apparatus; parts and accessories",217954.94,8.379315
45,694,Sierra Leone,64,Footwear; gaiters and the like; parts of such articles,131794.421,6.406529
46,694,Sierra Leone,21,Miscellaneous edible preparations,41378.506,6.396009
47,694,Sierra Leone,96,Miscellaneous manufactured articles,124144.04500000001,6.3351690000000005
48,694,Sierra Leone,95,"Toys, games and sports requisites; parts and accessories thereof",64024.371999999996,5.648059
49,694,Sierra Leone,78,Lead and articles thereof,5058.09,5.616448999999999
50,694,Sierra Leone,82,"Tools, implements, cutlery, spoons and forks, of base metal; parts thereof, of base metal",58706.052,4.95041
51,694,Sierra Leone,60,Fabrics; knitted or crocheted,69198.50899999999,3.5217069999999997
52,694,Sierra Leone,61,Apparel and clothing accessories; knitted or crocheted,86284.9,3.338316
53,694,Sierra Leone,02,Meat and edible meat offal,12334.639,2.980992
54,694,Sierra Leone,05,Animal originated products; not elsewhere specified or included,3617.658,2.4348389999999998
55,694,Sierra Leone,93,Arms and ammunition; parts and accessories thereof,33309.143,1.5021
56,694,Sierra Leone,10,Cereals,1465.293,1.5
57,694,Sierra Leone,63,"Textiles, made up articles; sets; worn clothing and worn textile articles; rags",6204.296,1.224704
58,694,Sierra Leone,69,Ceramic products,8662.744999999999,1.173688
59,694,Sierra Leone,62,Apparel and clothing accessories; not knitted or crocheted,64515.768,1.1384029999999998
60,694,Sierra Leone,35,Albuminoidal substances; modified starches; glues; enzymes,1157.348,1.0101900000000001
61,694,Sierra Leone,23,"Food industries, residues and wastes thereof; prepared animal fodder",27253.677,0.854001
62,694,Sierra Leone,65,Headgear and parts thereof,21410.52,0.807628
63,694,Sierra Leone,52,Cotton,4160.197,0.796462
64,694,Sierra Leone,37,Photographic or cinematographic goods,958.135,0.76
65,694,Sierra Leone,47,Pulp of wood or other fibrous cellulosic material; recovered (waste and scrap) paper or paperboard,41.576,0.754452
66,694,Sierra Leone,59,"Textile fabrics; impregnated, coated, covered or laminated; textile articles of a kind suitable for industrial use",8520.207,0.5994349999999999
67,694,Sierra Leone,30,Pharmaceutical products,12813.239000000001,0.582319
68,694,Sierra Leone,58,"Fabrics; special woven fabrics, tufted textile fabrics, lace, tapestries, trimmings, embroidery",947.186,0.5315219999999999
69,694,Sierra Leone,97,Works of art; collectors' pieces and antiques,16527.529000000002,0.395629
70,694,Sierra Leone,57,Carpets and other textile floor coverings,446.792,0.219464
71,694,Sierra Leone,79,Zinc and articles thereof,1186.598,0.207094
72,694,Sierra Leone,49,"Printed books, newspapers, pictures and other products of the printing industry; manuscripts, typescripts and plans",6362.013999999999,0.19661299999999998
73,694,Sierra Leone,88,"Aircraft, spacecraft, and parts thereof",52903.361999999994,0.18712299999999998
74,694,Sierra Leone,54,Man-made filaments; strip and the like of man-made textile materials,984.679,0.177765
75,694,Sierra Leone,42,"Articles of leather; saddlery and harness; travel goods, handbags and similar containers; articles of animal gut (other than silk-worm gut)",7997.226,0.09134
76,694,Sierra Leone,91,Clocks and watches and parts thereof,1562.359,0.08062300000000001
77,694,Sierra Leone,92,Musical instruments; parts and accessories of such articles,61.888999999999996,0.033678
78,694,Sierra Leone,55,Man-made staple fibres,227.688,0.021466
79,694,Sierra Leone,24,"Tobacco and manufactured tobacco substitutes; products, whether or not containing nicotine, intended for inhalation without combustion; other nicotine containing products intended for the intake of nicotine into the human body",53.274,0.019671
80,694,Sierra Leone,06,"Trees and other plants, live; bulbs, roots and the like; cut flowers and ornamental foliage",0.324,0.000272
