,exp_code_str3,exp_name,HS2,Description,USD,tonne
0,533,Aruba,27,"Mineral fuels, mineral oils and products of their distillation; bituminous substances; mineral waxes",47689557.803,77874.09634999999
1,533,Aruba,44,Wood and articles of wood; wood charcoal,3524851.156,9050.992359
2,533,Aruba,72,Iron and steel,2315971.492,7797.497911
3,533,Aruba,31,Fertilizers,7895.883,1531.8646820000001
4,533,Aruba,84,"Machinery and mechanical appliances, boilers, nuclear reactors; parts thereof",21663725.414,1320.3813209999998
5,533,Aruba,23,"Food industries, residues and wastes thereof; prepared animal fodder",842593.6460000001,960.654542
6,533,Aruba,74,Copper and articles thereof,3942381.071,852.259096
7,533,Aruba,15,"Animal, vegetable or microbial fats and oils and their cleavage products; prepared edible fats; animal or vegetable waxes",351420.379,595.079533
8,533,Aruba,48,"Paper and paperboard; articles of paper pulp, of paper or paperboard",894317.16,541.6686599999999
9,533,Aruba,85,"Electrical machinery and equipment and parts thereof; sound recorders and reproducers; television image and sound recorders and reproducers, parts and accessories of such articles",7281130.9,521.525256
10,533,Aruba,87,"Vehicles; other than railway or tramway rolling stock, and parts and accessories thereof",3813616.915,488.39573199999995
11,533,Aruba,28,"Inorganic chemicals; organic and inorganic compounds of precious metals; of rare earth metals, of radio-active elements and of isotopes",624811.752,450.262601
12,533,Aruba,39,Plastics and articles thereof,722744.325,448.90000599999996
13,533,Aruba,22,"Beverages, spirits and vinegar",81702.31599999999,338.15070099999997
14,533,Aruba,47,Pulp of wood or other fibrous cellulosic material; recovered (waste and scrap) paper or paperboard,43712.16100000001,337.40275299999996
15,533,Aruba,07,Vegetables and certain roots and tubers; edible,183006.003,330.192151
16,533,Aruba,38,Chemical products n.e.c.,607481.003,282.38375700000006
17,533,Aruba,73,Iron or steel articles,532376.4160000001,240.172945
18,533,Aruba,21,Miscellaneous edible preparations,2197375.187,235.536381
19,533,Aruba,94,"Furniture; bedding, mattresses, mattress supports, cushions and similar stuffed furnishings; lamps and lighting fittings, n.e.c.; illuminated signs, illuminated name-plates and the like; prefabricated buildings",276639.455,220.319842
20,533,Aruba,25,"Salt; sulphur; earths, stone; plastering materials, lime and cement",74164.409,200.379626
21,533,Aruba,34,"Soap, organic surface-active agents; washing, lubricating, polishing or scouring preparations; artificial or prepared waxes, candles and similar articles, modelling pastes, dental waxes and dental preparations with a basis of plaster",1593812.5089999998,169.136127
22,533,Aruba,04,"Dairy produce; birds' eggs; natural honey; edible products of animal origin, not elsewhere specified or included",432614.21599999996,154.45773100000002
23,533,Aruba,83,Metal; miscellaneous products of base metal,470387.095,141.600508
24,533,Aruba,56,"Wadding, felt and nonwovens, special yarns; twine, cordage, ropes and cables and articles thereof",373183.205,118.278462
25,533,Aruba,33,"Essential oils and resinoids; perfumery, cosmetic or toilet preparations",2082891.145,111.406196
26,533,Aruba,11,"Products of the milling industry; malt, starches, inulin, wheat gluten",196717.068,110.34
27,533,Aruba,35,Albuminoidal substances; modified starches; glues; enzymes,1795452.861,94.71373
28,533,Aruba,62,Apparel and clothing accessories; not knitted or crocheted,474880.00999999995,93.457174
29,533,Aruba,76,Aluminium and articles thereof,134368.571,90.266119
30,533,Aruba,86,"Railway, tramway locomotives, rolling-stock and parts thereof; railway or tramway track fixtures and fittings and parts thereof; mechanical (including electro-mechanical) traffic signalling equipment of all kinds",131283.32200000001,85.792705
31,533,Aruba,32,"Tanning or dyeing extracts; tannins and their derivatives; dyes, pigments and other colouring matter; paints, varnishes; putty, other mastics; inks",158034.486,83.90400499999998
32,533,Aruba,63,"Textiles, made up articles; sets; worn clothing and worn textile articles; rags",252999.817,58.777792
33,533,Aruba,88,"Aircraft, spacecraft, and parts thereof",61518426.057000004,50.491464
34,533,Aruba,90,"Optical, photographic, cinematographic, measuring, checking, medical or surgical instruments and apparatus; parts and accessories",1574677.502,46.847941
35,533,Aruba,03,"Fish and crustaceans, molluscs and other aquatic invertebrates",128702.15400000001,36.898797
36,533,Aruba,49,"Printed books, newspapers, pictures and other products of the printing industry; manuscripts, typescripts and plans",573979.414,31.143221
37,533,Aruba,40,Rubber and articles thereof,206134.782,30.262348
38,533,Aruba,20,"Preparations of vegetables, fruit, nuts or other parts of plants",42448.676,29.721547
39,533,Aruba,55,Man-made staple fibres,27340.093,26.602040000000002
40,533,Aruba,70,Glass and glassware,91553.357,25.933608
41,533,Aruba,12,"Oil seeds and oleaginous fruits; miscellaneous grains, seeds and fruit, industrial or medicinal plants; straw and fodder",216306.704,24.841947
42,533,Aruba,79,Zinc and articles thereof,49611.547000000006,23.585735999999997
43,533,Aruba,29,Organic chemicals,42492.613,23.028001
44,533,Aruba,02,Meat and edible meat offal,92643.025,20.5
45,533,Aruba,69,Ceramic products,40474.346,18.491546
46,533,Aruba,95,"Toys, games and sports requisites; parts and accessories thereof",20203.918999999998,15.52166
47,533,Aruba,30,Pharmaceutical products,626414.148,14.028506
48,533,Aruba,61,Apparel and clothing accessories; knitted or crocheted,140652.696,13.63094
49,533,Aruba,82,"Tools, implements, cutlery, spoons and forks, of base metal; parts thereof, of base metal",29348.768,12.311979
50,533,Aruba,78,Lead and articles thereof,26206.219,11.360207
51,533,Aruba,54,Man-made filaments; strip and the like of man-made textile materials,35150.545,9.432866
52,533,Aruba,64,Footwear; gaiters and the like; parts of such articles,114671.05,8.869917000000001
53,533,Aruba,96,Miscellaneous manufactured articles,49732.199,8.365534
54,533,Aruba,42,"Articles of leather; saddlery and harness; travel goods, handbags and similar containers; articles of animal gut (other than silk-worm gut)",74178.108,7.304036999999999
55,533,Aruba,75,Nickel and articles thereof,3494.0950000000003,7.048909
56,533,Aruba,24,"Tobacco and manufactured tobacco substitutes; products, whether or not containing nicotine, intended for inhalation without combustion; other nicotine containing products intended for the intake of nicotine into the human body",119216.181,5.558597
57,533,Aruba,17,Sugars and sugar confectionery,14387.009999999998,4.093076
58,533,Aruba,57,Carpets and other textile floor coverings,10639.599999999999,3.9433840000000004
59,533,Aruba,09,"Coffee, tea, mate and spices",27334.375,2.760909
60,533,Aruba,91,Clocks and watches and parts thereof,112274.387,2.39689
61,533,Aruba,97,Works of art; collectors' pieces and antiques,8839.294,1.719529
62,533,Aruba,71,"Natural, cultured pearls; precious, semi-precious stones; precious metals, metals clad with precious metal, and articles thereof; imitation jewellery; coin",789225.215,1.6609909999999999
63,533,Aruba,58,"Fabrics; special woven fabrics, tufted textile fabrics, lace, tapestries, trimmings, embroidery",6484.14,1.560442
64,533,Aruba,18,Cocoa and cocoa preparations,9490.042000000001,1.5522449999999999
65,533,Aruba,68,"Stone, plaster, cement, asbestos, mica or similar materials; articles thereof",3740.946,1.40047
66,533,Aruba,13,"Lac; gums, resins and other vegetable saps and extracts",15650.229,0.9886900000000001
67,533,Aruba,05,Animal originated products; not elsewhere specified or included,12177.254,0.708413
68,533,Aruba,16,"Meat, fish, crustaceans, molluscs or other aquatic invertebrates, or insects; preparations thereof",14956.323,0.499127
69,533,Aruba,92,Musical instruments; parts and accessories of such articles,2783.932,0.33988999999999997
70,533,Aruba,46,"Manufactures of straw, esparto or other plaiting materials; basketware and wickerwork",1516.349,0.28859500000000005
71,533,Aruba,06,"Trees and other plants, live; bulbs, roots and the like; cut flowers and ornamental foliage",24759.779,0.279473
72,533,Aruba,37,Photographic or cinematographic goods,1085.301,0.252442
73,533,Aruba,65,Headgear and parts thereof,938.194,0.243231
74,533,Aruba,19,"Preparations of cereals, flour, starch or milk; pastrycooks' products",1437.167,0.241892
75,533,Aruba,80,Tin; articles thereof,250.66500000000002,0.215011
76,533,Aruba,89,"Ships, boats and floating structures",1163.275,0.132073
77,533,Aruba,59,"Textile fabrics; impregnated, coated, covered or laminated; textile articles of a kind suitable for industrial use",3129.441,0.069353
78,533,Aruba,93,Arms and ammunition; parts and accessories thereof,88.449,0.051362000000000005
79,533,Aruba,52,Cotton,189.003,0.02179
80,533,Aruba,43,Furskins and artificial fur; manufactures thereof,3271.587,0.0022719999999999997
81,533,Aruba,01,Animals; live,7.856,0.000403
