,exp_code_str3,exp_name,HS2,Description,USD,tonne
0,784,United Arab Emirates,27,"Mineral fuels, mineral oils and products of their distillation; bituminous substances; mineral waxes",73021700923.274,151916324.578877
1,784,United Arab Emirates,25,"Salt; sulphur; earths, stone; plastering materials, lime and cement",907952025.246,15935769.242006
2,784,United Arab Emirates,72,Iron and steel,2100602473.065,4460851.752198
3,784,United Arab Emirates,39,Plastics and articles thereof,2303570722.969,1752381.804369
4,784,United Arab Emirates,31,Fertilizers,378790158.485,1459753.1028709998
5,784,United Arab Emirates,68,"Stone, plaster, cement, asbestos, mica or similar materials; articles thereof",107013042.67899999,1352880.885192
6,784,United Arab Emirates,76,Aluminium and articles thereof,3034486745.8209996,1291801.722945
7,784,United Arab Emirates,29,Organic chemicals,517258589.284,808489.86864
8,784,United Arab Emirates,73,Iron or steel articles,1015886755.817,790886.076304
9,784,United Arab Emirates,89,"Ships, boats and floating structures",594591336.6689999,602505.6300679999
10,784,United Arab Emirates,10,Cereals,181771743.543,518137.607401
11,784,United Arab Emirates,17,Sugars and sugar confectionery,254248099.813,463542.05946200003
12,784,United Arab Emirates,48,"Paper and paperboard; articles of paper pulp, of paper or paperboard",385215330.702,449708.34934099996
13,784,United Arab Emirates,28,"Inorganic chemicals; organic and inorganic compounds of precious metals; of rare earth metals, of radio-active elements and of isotopes",165320943.195,378732.380195
14,784,United Arab Emirates,70,Glass and glassware,225488941.114,317224.3803
15,784,United Arab Emirates,23,"Food industries, residues and wastes thereof; prepared animal fodder",113673567.82000001,292518.720748
16,784,United Arab Emirates,87,"Vehicles; other than railway or tramway rolling stock, and parts and accessories thereof",1125720149.478,232883.484877
17,784,United Arab Emirates,38,Chemical products n.e.c.,246072553.881,229734.246121
18,784,United Arab Emirates,84,"Machinery and mechanical appliances, boilers, nuclear reactors; parts thereof",1112721665.764,214372.802447
19,784,United Arab Emirates,22,"Beverages, spirits and vinegar",86916810.38,209665.096682
20,784,United Arab Emirates,04,"Dairy produce; birds' eggs; natural honey; edible products of animal origin, not elsewhere specified or included",423719213.486,189955.560363
21,784,United Arab Emirates,85,"Electrical machinery and equipment and parts thereof; sound recorders and reproducers; television image and sound recorders and reproducers, parts and accessories of such articles",733275774.453,159636.524171
22,784,United Arab Emirates,08,"Fruit and nuts, edible; peel of citrus fruit or melons",334493632.164,144391.223089
23,784,United Arab Emirates,74,Copper and articles thereof,840823777.596,143657.067596
24,784,United Arab Emirates,26,"Ores, slag and ash",30853485.275000002,126855.1937
25,784,United Arab Emirates,32,"Tanning or dyeing extracts; tannins and their derivatives; dyes, pigments and other colouring matter; paints, varnishes; putty, other mastics; inks",203133253.37399998,120933.526959
26,784,United Arab Emirates,69,Ceramic products,53125304.92,108867.971777
27,784,United Arab Emirates,44,Wood and articles of wood; wood charcoal,71572633.924,100980.801393
28,784,United Arab Emirates,15,"Animal, vegetable or microbial fats and oils and their cleavage products; prepared edible fats; animal or vegetable waxes",80428798.473,100702.497429
29,784,United Arab Emirates,40,Rubber and articles thereof,206229639.311,98999.068721
30,784,United Arab Emirates,94,"Furniture; bedding, mattresses, mattress supports, cushions and similar stuffed furnishings; lamps and lighting fittings, n.e.c.; illuminated signs, illuminated name-plates and the like; prefabricated buildings",244972251.702,91554.242868
31,784,United Arab Emirates,20,"Preparations of vegetables, fruit, nuts or other parts of plants",70034727.143,85600.84014500001
32,784,United Arab Emirates,34,"Soap, organic surface-active agents; washing, lubricating, polishing or scouring preparations; artificial or prepared waxes, candles and similar articles, modelling pastes, dental waxes and dental preparations with a basis of plaster",150897498.533,76433.31174599999
33,784,United Arab Emirates,63,"Textiles, made up articles; sets; worn clothing and worn textile articles; rags",45193905.058,54330.055508
34,784,United Arab Emirates,47,Pulp of wood or other fibrous cellulosic material; recovered (waste and scrap) paper or paperboard,10904970.573,48693.560387000005
35,784,United Arab Emirates,21,Miscellaneous edible preparations,49202085.081,42886.757114
36,784,United Arab Emirates,19,"Preparations of cereals, flour, starch or milk; pastrycooks' products",60620517.055,36612.93348
37,784,United Arab Emirates,12,"Oil seeds and oleaginous fruits; miscellaneous grains, seeds and fruit, industrial or medicinal plants; straw and fodder",39790076.966,35681.371294000004
38,784,United Arab Emirates,02,Meat and edible meat offal,56778552.36799999,33936.620243
39,784,United Arab Emirates,57,Carpets and other textile floor coverings,65244546.574,33844.072984000006
40,784,United Arab Emirates,79,Zinc and articles thereof,82462240.052,31439.920886
41,784,United Arab Emirates,09,"Coffee, tea, mate and spices",202765019.816,31438.973269000002
42,784,United Arab Emirates,03,"Fish and crustaceans, molluscs and other aquatic invertebrates",165601307.834,28366.136597
43,784,United Arab Emirates,07,Vegetables and certain roots and tubers; edible,28343126.272,27300.371066
44,784,United Arab Emirates,83,Metal; miscellaneous products of base metal,92659820.276,26764.941249
45,784,United Arab Emirates,86,"Railway, tramway locomotives, rolling-stock and parts thereof; railway or tramway track fixtures and fittings and parts thereof; mechanical (including electro-mechanical) traffic signalling equipment of all kinds",14771598.439,25989.572469
46,784,United Arab Emirates,33,"Essential oils and resinoids; perfumery, cosmetic or toilet preparations",141830940.451,22958.422635
47,784,United Arab Emirates,78,Lead and articles thereof,37317479.008,22916.082314
48,784,United Arab Emirates,54,Man-made filaments; strip and the like of man-made textile materials,58727077.216000006,20680.090537
49,784,United Arab Emirates,11,"Products of the milling industry; malt, starches, inulin, wheat gluten",11894502.688000001,16658.517798
50,784,United Arab Emirates,35,Albuminoidal substances; modified starches; glues; enzymes,19886382.957,14449.445372
51,784,United Arab Emirates,71,"Natural, cultured pearls; precious, semi-precious stones; precious metals, metals clad with precious metal, and articles thereof; imitation jewellery; coin",512627327.232,12901.821632
52,784,United Arab Emirates,96,Miscellaneous manufactured articles,47282176.291,12579.657879
53,784,United Arab Emirates,24,"Tobacco and manufactured tobacco substitutes; products, whether or not containing nicotine, intended for inhalation without combustion; other nicotine containing products intended for the intake of nicotine into the human body",43849317.61,8837.297627
54,784,United Arab Emirates,55,Man-made staple fibres,12581802.933,8830.851963000001
55,784,United Arab Emirates,56,"Wadding, felt and nonwovens, special yarns; twine, cordage, ropes and cables and articles thereof",23220540.14,8240.791067
56,784,United Arab Emirates,82,"Tools, implements, cutlery, spoons and forks, of base metal; parts thereof, of base metal",15972387.083,7274.849195
57,784,United Arab Emirates,95,"Toys, games and sports requisites; parts and accessories thereof",40032047.144,7247.626951
58,784,United Arab Emirates,16,"Meat, fish, crustaceans, molluscs or other aquatic invertebrates, or insects; preparations thereof",13390629.901,6633.768754000001
59,784,United Arab Emirates,90,"Optical, photographic, cinematographic, measuring, checking, medical or surgical instruments and apparatus; parts and accessories",60033686.048999995,5325.9647860000005
60,784,United Arab Emirates,59,"Textile fabrics; impregnated, coated, covered or laminated; textile articles of a kind suitable for industrial use",8015683.299,4731.166404
61,784,United Arab Emirates,41,Raw hides and skins (other than furskins) and leather,8720596.603000002,3925.4589509999996
62,784,United Arab Emirates,49,"Printed books, newspapers, pictures and other products of the printing industry; manuscripts, typescripts and plans",46184704.361999996,3856.3460339999997
63,784,United Arab Emirates,18,Cocoa and cocoa preparations,13455402.739,2858.0186449999997
64,784,United Arab Emirates,80,Tin; articles thereof,8349539.227000001,2800.2361100000003
65,784,United Arab Emirates,30,Pharmaceutical products,26466176.214,2761.8665859999996
66,784,United Arab Emirates,13,"Lac; gums, resins and other vegetable saps and extracts",14879580.362,2656.24586
67,784,United Arab Emirates,61,Apparel and clothing accessories; knitted or crocheted,16351208.327,2208.802435
68,784,United Arab Emirates,64,Footwear; gaiters and the like; parts of such articles,10013546.074,1925.6039
69,784,United Arab Emirates,42,"Articles of leather; saddlery and harness; travel goods, handbags and similar containers; articles of animal gut (other than silk-worm gut)",5776408.151000001,1919.398224
70,784,United Arab Emirates,62,Apparel and clothing accessories; not knitted or crocheted,18520119.862,1897.075929
71,784,United Arab Emirates,36,Explosives; pyrotechnic products; matches; pyrophoric alloys; certain combustible preparations,3154355.11,1893.452399
72,784,United Arab Emirates,37,Photographic or cinematographic goods,5040103.537,1498.136917
73,784,United Arab Emirates,46,"Manufactures of straw, esparto or other plaiting materials; basketware and wickerwork",2558870.943,1393.7206910000002
74,784,United Arab Emirates,75,Nickel and articles thereof,4160541.0549999997,1261.0572900000002
75,784,United Arab Emirates,45,Cork and articles of cork,1688326.827,868.438312
76,784,United Arab Emirates,93,Arms and ammunition; parts and accessories thereof,2823285.174,852.597486
77,784,United Arab Emirates,52,Cotton,2283869.396,776.940415
78,784,United Arab Emirates,88,"Aircraft, spacecraft, and parts thereof",166428375.826,743.251932
79,784,United Arab Emirates,67,"Feathers and down, prepared; and articles made of feather or of down; artificial flowers; articles of human hair",1823851.9449999998,725.763521
80,784,United Arab Emirates,60,Fabrics; knitted or crocheted,2053029.769,533.509226
81,784,United Arab Emirates,58,"Fabrics; special woven fabrics, tufted textile fabrics, lace, tapestries, trimmings, embroidery",1198065.894,472.440123
82,784,United Arab Emirates,50,Silk,853623.21,457.875272
83,784,United Arab Emirates,66,"Umbrellas, sun umbrellas, walking-sticks, seat sticks, whips, riding crops; and parts thereof",780095.8809999999,444.628576
84,784,United Arab Emirates,53,Vegetable textile fibres; paper yarn and woven fabrics of paper yarn,193812.481,421.196526
85,784,United Arab Emirates,97,Works of art; collectors' pieces and antiques,5382025.418,415.27272600000003
86,784,United Arab Emirates,06,"Trees and other plants, live; bulbs, roots and the like; cut flowers and ornamental foliage",1015192.135,384.262676
87,784,United Arab Emirates,91,Clocks and watches and parts thereof,3924343.109,300.55202
88,784,United Arab Emirates,65,Headgear and parts thereof,1203029.837,283.999725
89,784,United Arab Emirates,92,Musical instruments; parts and accessories of such articles,698342.91,200.130493
90,784,United Arab Emirates,81,"Metals; n.e.c., cermets and articles thereof",663371.086,109.76271
91,784,United Arab Emirates,05,Animal originated products; not elsewhere specified or included,373484.973,79.205963
92,784,United Arab Emirates,43,Furskins and artificial fur; manufactures thereof,128878.90500000001,56.563921
93,784,United Arab Emirates,14,Vegetable plaiting materials; vegetable products not elsewhere specified or included,7947.321,45.229552
94,784,United Arab Emirates,51,"Wool, fine or coarse animal hair; horsehair yarn and woven fabric",90981.236,37.496317
95,784,United Arab Emirates,01,Animals; live,219.416,0.017324
