,exp_code_str3,exp_name,HS2,Description,USD,tonne
0,308,Grenada,09,"Coffee, tea, mate and spices",7338643.419,902.402599
1,308,Grenada,03,"Fish and crustaceans, molluscs and other aquatic invertebrates",5310089.191,643.703726
2,308,Grenada,11,"Products of the milling industry; malt, starches, inulin, wheat gluten",3182259.081,5352.360481000001
3,308,Grenada,08,"Fruit and nuts, edible; peel of citrus fruit or melons",2753590.472,561.7410479999999
4,308,Grenada,22,"Beverages, spirits and vinegar",2149684.836,2666.347934
5,308,Grenada,87,"Vehicles; other than railway or tramway rolling stock, and parts and accessories thereof",2130416.358,418.018571
6,308,Grenada,18,Cocoa and cocoa preparations,2058598.2689999999,784.9543819999999
7,308,Grenada,23,"Food industries, residues and wastes thereof; prepared animal fodder",1603305.2280000001,3214.8909590000003
8,308,Grenada,48,"Paper and paperboard; articles of paper pulp, of paper or paperboard",1368866.438,611.9474439999999
9,308,Grenada,32,"Tanning or dyeing extracts; tannins and their derivatives; dyes, pigments and other colouring matter; paints, varnishes; putty, other mastics; inks",956085.0580000001,332.514198
10,308,Grenada,84,"Machinery and mechanical appliances, boilers, nuclear reactors; parts thereof",563207.095,49.62421
11,308,Grenada,85,"Electrical machinery and equipment and parts thereof; sound recorders and reproducers; television image and sound recorders and reproducers, parts and accessories of such articles",554687.776,479.084728
12,308,Grenada,30,Pharmaceutical products,247707.17599999998,3.297647
13,308,Grenada,07,Vegetables and certain roots and tubers; edible,231684.251,113.179557
14,308,Grenada,73,Iron or steel articles,210822.26,100.538465
15,308,Grenada,25,"Salt; sulphur; earths, stone; plastering materials, lime and cement",192791.227,4186.788077
16,308,Grenada,72,Iron and steel,157078.033,482.23901700000005
17,308,Grenada,90,"Optical, photographic, cinematographic, measuring, checking, medical or surgical instruments and apparatus; parts and accessories",142876.13900000002,2.8957930000000003
18,308,Grenada,10,Cereals,138139.618,5.643255
19,308,Grenada,71,"Natural, cultured pearls; precious, semi-precious stones; precious metals, metals clad with precious metal, and articles thereof; imitation jewellery; coin",129557.098,0.008683
20,308,Grenada,21,Miscellaneous edible preparations,105917.29699999999,88.69046999999999
21,308,Grenada,33,"Essential oils and resinoids; perfumery, cosmetic or toilet preparations",104255.551,13.553368000000003
22,308,Grenada,28,"Inorganic chemicals; organic and inorganic compounds of precious metals; of rare earth metals, of radio-active elements and of isotopes",98524.54800000001,128.997561
23,308,Grenada,02,Meat and edible meat offal,89537.687,13.577
24,308,Grenada,86,"Railway, tramway locomotives, rolling-stock and parts thereof; railway or tramway track fixtures and fittings and parts thereof; mechanical (including electro-mechanical) traffic signalling equipment of all kinds",88370.038,4.208029000000001
25,308,Grenada,61,Apparel and clothing accessories; knitted or crocheted,75863.12700000001,2.508878
26,308,Grenada,74,Copper and articles thereof,58473.038,12.458562
27,308,Grenada,19,"Preparations of cereals, flour, starch or milk; pastrycooks' products",49811.231,6.474018999999999
28,308,Grenada,78,Lead and articles thereof,40083.475,38.429824999999994
29,308,Grenada,34,"Soap, organic surface-active agents; washing, lubricating, polishing or scouring preparations; artificial or prepared waxes, candles and similar articles, modelling pastes, dental waxes and dental preparations with a basis of plaster",36312.113,12.372807
30,308,Grenada,94,"Furniture; bedding, mattresses, mattress supports, cushions and similar stuffed furnishings; lamps and lighting fittings, n.e.c.; illuminated signs, illuminated name-plates and the like; prefabricated buildings",35960.358,23.442371
31,308,Grenada,68,"Stone, plaster, cement, asbestos, mica or similar materials; articles thereof",29455.408,15.92517
32,308,Grenada,70,Glass and glassware,28362.094999999998,40.272887000000004
33,308,Grenada,82,"Tools, implements, cutlery, spoons and forks, of base metal; parts thereof, of base metal",25366.046,0.7403959999999999
34,308,Grenada,62,Apparel and clothing accessories; not knitted or crocheted,24823.179,10.743224000000001
35,308,Grenada,39,Plastics and articles thereof,24045.477,5.43466
36,308,Grenada,38,Chemical products n.e.c.,22531.787,3.8655630000000003
37,308,Grenada,63,"Textiles, made up articles; sets; worn clothing and worn textile articles; rags",18690.762,3.777926
38,308,Grenada,16,"Meat, fish, crustaceans, molluscs or other aquatic invertebrates, or insects; preparations thereof",17405.673,0.9403239999999999
39,308,Grenada,20,"Preparations of vegetables, fruit, nuts or other parts of plants",14082.296999999999,6.866731
40,308,Grenada,49,"Printed books, newspapers, pictures and other products of the printing industry; manuscripts, typescripts and plans",14062.631000000001,2.734025
41,308,Grenada,27,"Mineral fuels, mineral oils and products of their distillation; bituminous substances; mineral waxes",13616.958,78.93174
42,308,Grenada,55,Man-made staple fibres,12531.236,1.108727
43,308,Grenada,76,Aluminium and articles thereof,12409.864000000001,12.472218
44,308,Grenada,88,"Aircraft, spacecraft, and parts thereof",12222.947,0.071946
45,308,Grenada,29,Organic chemicals,11677.501,1.159751
46,308,Grenada,96,Miscellaneous manufactured articles,10973.528,1.059212
47,308,Grenada,69,Ceramic products,10857.099,4.674912
48,308,Grenada,50,Silk,10037.671,2.904983
49,308,Grenada,24,"Tobacco and manufactured tobacco substitutes; products, whether or not containing nicotine, intended for inhalation without combustion; other nicotine containing products intended for the intake of nicotine into the human body",9390.415,0.20787899999999998
50,308,Grenada,15,"Animal, vegetable or microbial fats and oils and their cleavage products; prepared edible fats; animal or vegetable waxes",7449.682999999999,8.607551
51,308,Grenada,40,Rubber and articles thereof,6461.044,0.6314299999999999
52,308,Grenada,12,"Oil seeds and oleaginous fruits; miscellaneous grains, seeds and fruit, industrial or medicinal plants; straw and fodder",6297.388,2.5114989999999997
53,308,Grenada,89,"Ships, boats and floating structures",5999.407,1.053066
54,308,Grenada,56,"Wadding, felt and nonwovens, special yarns; twine, cordage, ropes and cables and articles thereof",5751.468000000001,8.604123999999999
55,308,Grenada,04,"Dairy produce; birds' eggs; natural honey; edible products of animal origin, not elsewhere specified or included",3868.131,0.423
56,308,Grenada,42,"Articles of leather; saddlery and harness; travel goods, handbags and similar containers; articles of animal gut (other than silk-worm gut)",2957.802,0.21797400000000003
57,308,Grenada,44,Wood and articles of wood; wood charcoal,2654.797,2.090464
58,308,Grenada,83,Metal; miscellaneous products of base metal,2029.191,0.396545
59,308,Grenada,95,"Toys, games and sports requisites; parts and accessories thereof",1806.17,1.3731499999999999
60,308,Grenada,65,Headgear and parts thereof,866.291,0.005881
61,308,Grenada,35,Albuminoidal substances; modified starches; glues; enzymes,271.497,0.06001
62,308,Grenada,57,Carpets and other textile floor coverings,231.11,0.433719
63,308,Grenada,58,"Fabrics; special woven fabrics, tufted textile fabrics, lace, tapestries, trimmings, embroidery",190.933,0.005511
64,308,Grenada,37,Photographic or cinematographic goods,184.547,0.003572
65,308,Grenada,64,Footwear; gaiters and the like; parts of such articles,120.31700000000001,0.275422
66,308,Grenada,92,Musical instruments; parts and accessories of such articles,64.702,0.046619
67,308,Grenada,81,"Metals; n.e.c., cermets and articles thereof",38.213,0.009630000000000001
68,308,Grenada,93,Arms and ammunition; parts and accessories thereof,23.159,0.084716
69,308,Grenada,01,Animals; live,7.856,0.0052840000000000005
70,308,Grenada,60,Fabrics; knitted or crocheted,0.618,5.3e-05
