,exp_code_str3,exp_name,HS2,Description,USD,tonne
0,652,Saint Barthélemy,33,"Essential oils and resinoids; perfumery, cosmetic or toilet preparations",2489426.95,88.70870900000001
1,652,Saint Barthélemy,26,"Ores, slag and ash",347607.377,10476.102653000002
2,652,Saint Barthélemy,87,"Vehicles; other than railway or tramway rolling stock, and parts and accessories thereof",336126.271,40.779285
3,652,Saint Barthélemy,84,"Machinery and mechanical appliances, boilers, nuclear reactors; parts thereof",275835.368,28.23094
4,652,Saint Barthélemy,16,"Meat, fish, crustaceans, molluscs or other aquatic invertebrates, or insects; preparations thereof",272880.139,63.017196999999996
5,652,Saint Barthélemy,22,"Beverages, spirits and vinegar",172245.25100000002,46.487351000000004
6,652,Saint Barthélemy,24,"Tobacco and manufactured tobacco substitutes; products, whether or not containing nicotine, intended for inhalation without combustion; other nicotine containing products intended for the intake of nicotine into the human body",147940.263,1.9376600000000002
7,652,Saint Barthélemy,39,Plastics and articles thereof,136007.307,42.631885
8,652,Saint Barthélemy,04,"Dairy produce; birds' eggs; natural honey; edible products of animal origin, not elsewhere specified or included",127586.247,43.970942
9,652,Saint Barthélemy,31,Fertilizers,92962.313,169.78101500000002
10,652,Saint Barthélemy,34,"Soap, organic surface-active agents; washing, lubricating, polishing or scouring preparations; artificial or prepared waxes, candles and similar articles, modelling pastes, dental waxes and dental preparations with a basis of plaster",90495.432,56.103291999999996
11,652,Saint Barthélemy,85,"Electrical machinery and equipment and parts thereof; sound recorders and reproducers; television image and sound recorders and reproducers, parts and accessories of such articles",89998.414,3.4760220000000004
12,652,Saint Barthélemy,94,"Furniture; bedding, mattresses, mattress supports, cushions and similar stuffed furnishings; lamps and lighting fittings, n.e.c.; illuminated signs, illuminated name-plates and the like; prefabricated buildings",84647.873,21.23628
13,652,Saint Barthélemy,21,Miscellaneous edible preparations,84298.004,26.90242
14,652,Saint Barthélemy,76,Aluminium and articles thereof,81872.974,12.127603
15,652,Saint Barthélemy,89,"Ships, boats and floating structures",81792.489,3.5423069999999997
16,652,Saint Barthélemy,54,Man-made filaments; strip and the like of man-made textile materials,78737.278,13.761038
17,652,Saint Barthélemy,73,Iron or steel articles,75849.35200000001,25.885065
18,652,Saint Barthélemy,08,"Fruit and nuts, edible; peel of citrus fruit or melons",75809.539,118.014863
19,652,Saint Barthélemy,07,Vegetables and certain roots and tubers; edible,75203.18400000001,58.01415399999999
20,652,Saint Barthélemy,61,Apparel and clothing accessories; knitted or crocheted,70244.822,2.284276
21,652,Saint Barthélemy,72,Iron and steel,57829.282,96.042394
22,652,Saint Barthélemy,95,"Toys, games and sports requisites; parts and accessories thereof",54407.98,3.06887
23,652,Saint Barthélemy,60,Fabrics; knitted or crocheted,52230.633,5.0999680000000005
24,652,Saint Barthélemy,29,Organic chemicals,47695.367,24.061253999999998
25,652,Saint Barthélemy,68,"Stone, plaster, cement, asbestos, mica or similar materials; articles thereof",38240.697,45.490577
26,652,Saint Barthélemy,97,Works of art; collectors' pieces and antiques,37515.87,1.789967
27,652,Saint Barthélemy,70,Glass and glassware,35243.944,9.459879
28,652,Saint Barthélemy,19,"Preparations of cereals, flour, starch or milk; pastrycooks' products",33414.152,3.465282
29,652,Saint Barthélemy,44,Wood and articles of wood; wood charcoal,28361.753,43.086869
30,652,Saint Barthélemy,52,Cotton,24808.2,8.919933
31,652,Saint Barthélemy,62,Apparel and clothing accessories; not knitted or crocheted,22029.293,0.490926
32,652,Saint Barthélemy,64,Footwear; gaiters and the like; parts of such articles,20617.585000000003,1.509425
33,652,Saint Barthélemy,06,"Trees and other plants, live; bulbs, roots and the like; cut flowers and ornamental foliage",20510.336000000003,7.199492000000001
34,652,Saint Barthélemy,20,"Preparations of vegetables, fruit, nuts or other parts of plants",19417.3,7.626069
35,652,Saint Barthélemy,42,"Articles of leather; saddlery and harness; travel goods, handbags and similar containers; articles of animal gut (other than silk-worm gut)",16004.305,0.8259099999999999
36,652,Saint Barthélemy,82,"Tools, implements, cutlery, spoons and forks, of base metal; parts thereof, of base metal",11207.33,0.835027
37,652,Saint Barthélemy,05,Animal originated products; not elsewhere specified or included,11094.568,0.0029660000000000003
38,652,Saint Barthélemy,02,Meat and edible meat offal,10558.702000000001,3.408618
39,652,Saint Barthélemy,28,"Inorganic chemicals; organic and inorganic compounds of precious metals; of rare earth metals, of radio-active elements and of isotopes",9857.921,0.200739
40,652,Saint Barthélemy,40,Rubber and articles thereof,9473.986,0.814931
41,652,Saint Barthélemy,12,"Oil seeds and oleaginous fruits; miscellaneous grains, seeds and fruit, industrial or medicinal plants; straw and fodder",8819.196,9.439945999999999
42,652,Saint Barthélemy,47,Pulp of wood or other fibrous cellulosic material; recovered (waste and scrap) paper or paperboard,8244.242,86.847364
43,652,Saint Barthélemy,91,Clocks and watches and parts thereof,6426.564,0.001618
44,652,Saint Barthélemy,27,"Mineral fuels, mineral oils and products of their distillation; bituminous substances; mineral waxes",5229.6990000000005,13.510849000000002
45,652,Saint Barthélemy,41,Raw hides and skins (other than furskins) and leather,3823.039,0.12006
46,652,Saint Barthélemy,90,"Optical, photographic, cinematographic, measuring, checking, medical or surgical instruments and apparatus; parts and accessories",3743.952,0.066915
47,652,Saint Barthélemy,63,"Textiles, made up articles; sets; worn clothing and worn textile articles; rags",3417.258,0.187166
48,652,Saint Barthélemy,69,Ceramic products,2749.368,0.9569070000000001
49,652,Saint Barthélemy,32,"Tanning or dyeing extracts; tannins and their derivatives; dyes, pigments and other colouring matter; paints, varnishes; putty, other mastics; inks",2362.506,0.571253
50,652,Saint Barthélemy,83,Metal; miscellaneous products of base metal,1522.1419999999998,0.13984000000000002
51,652,Saint Barthélemy,38,Chemical products n.e.c.,1017.645,1.722273
52,652,Saint Barthélemy,49,"Printed books, newspapers, pictures and other products of the printing industry; manuscripts, typescripts and plans",977.549,0.18842299999999998
53,652,Saint Barthélemy,71,"Natural, cultured pearls; precious, semi-precious stones; precious metals, metals clad with precious metal, and articles thereof; imitation jewellery; coin",721.527,0.010959
54,652,Saint Barthélemy,48,"Paper and paperboard; articles of paper pulp, of paper or paperboard",587.449,0.13947900000000002
55,652,Saint Barthélemy,88,"Aircraft, spacecraft, and parts thereof",333.981,0.767366
56,652,Saint Barthélemy,25,"Salt; sulphur; earths, stone; plastering materials, lime and cement",326.736,36.382650999999996
57,652,Saint Barthélemy,15,"Animal, vegetable or microbial fats and oils and their cleavage products; prepared edible fats; animal or vegetable waxes",303.347,0.43711
58,652,Saint Barthélemy,18,Cocoa and cocoa preparations,270.01,0.011125999999999999
59,652,Saint Barthélemy,57,Carpets and other textile floor coverings,245.094,0.046
60,652,Saint Barthélemy,59,"Textile fabrics; impregnated, coated, covered or laminated; textile articles of a kind suitable for industrial use",90.57,0.006602
61,652,Saint Barthélemy,58,"Fabrics; special woven fabrics, tufted textile fabrics, lace, tapestries, trimmings, embroidery",89.541,0.000787
62,652,Saint Barthélemy,81,"Metals; n.e.c., cermets and articles thereof",48.46,0.000734
